{
  "id": "obs-7b91e1d2-0943-4f9e-a02b-8a6e3d2a0145",
  "sensor_id": "sn-iot-delhi-anand-vihar-04",
  "timestamp": "2026-09-08T16:00:00Z",
  "tier": "OBSERVED",
  "pm25": 186.4,
  "pm10": 312.8,
  "no2": 64.2,
  "so2": 18.1,
  "co": 2.4,
  "o3": 28.5,
  "aqi": 236,
  "temperature_c": 31.4,
  "humidity_percent": 62,
  "wind_speed_kmh": 14.2,
  "wind_direction_deg": 290
}
